mes,dia,nombre,prioridad,descripcion,imagen,url_wikipedia,oracion
11,6,Beato Eugenio Andrés Amo,40,"El Beato Eugenio Andrés Amoes recordado por su valentía durante la persecución religiosa en España entre 1934 y 1937. Su beatificación, junto con otros 497 mártires, fue llevada a cabo por el Papa Benedicto XVI el 28 de octubre de 2007 en Roma. Durante los años de persecución, Eugenio Andrés Amo mostró una fe inquebrantable hasta su muerte. Su sacrificio es un testimonio de devoción y resistencia e",,https://es.wikipedia.org/wiki/Amo_de_casa_(serie_de_televisión_colombiana),
11,6,Beato Eugenio Cernuda Febrero,40,"El Beato Eugenio Cernuda Febreroes recordado por su valentía durante la persecución religiosa en España entre 1934 y 1937. Este periodo fue marcado por una intensa represión hacia los religiosos y laicos comprometidos con su fe. El 28 de octubre de 2007, el Papa Benedicto XVI beatificó a Eugenio junto a otros 497 mártires en una ceremonia en Roma, reconociendo su sacrificio y dedicación a la fe. Su",eugenio_cernuda_febrero.png,https://es.wikipedia.org/wiki/Marquesado_de_Pacheco,
11,6,Beato Eusebio Andrés,40,"El Beato Eusebio Andrés, nacido como Eusebio Roldán Vielba, es recordado como un mártir de la persecución religiosa en España durante los años turbulentos de 1934 a 1937. Su vida es un testimonio de fe y sacrificio, culminando en su beatificación junto a otros 497 mártires el 28 de octubre de 2007 por el Papa Benedicto XVI. Eusebio fue miembro de los Hermanos de las Escuelas Cristianas, dedicando s",eusebio_andres.png,https://es.wikipedia.org/wiki/Eusebio_Guilarte_Mole,
11,6,Beato Eusebio del Niño Jesús,40,"El Beato Eusebio del Niño Jesús, cuyo nombre de nacimiento era Ovidio Fernández Arenillas, es recordado como uno de los mártires de la persecución religiosa en España durante el siglo XX. Nació en el contexto de una España convulsionada por tensiones políticas y sociales que desembocaron en una sangrienta guerra civil. Eusebio y otros religiosos fueron perseguidos por su fe y dedicación a la Iglesi",eusebio_del_nino_jesus.jpg,https://es.wikipedia.org/wiki/Teresa_del_Niño_Jesús_y_de_San_Juan_de_la_Cruz,
11,6,Beato Eustaquio,40,"El Beato Eustaquio, conocido en vida como Luis Villanueva Montoya, es recordado como un mártir de la persecución religiosa en España entre 1934 y 1937. Fue beatificado junto a 497 mártires por el papa Benedicto XVI el 28 de octubre de 2007 en Roma. Durante la persecución religiosa, Eustaquio se mantuvo firme en su fe, destacándose por su devoción y valentía en tiempos de gran adversidad. Su sacrifi",,https://es.wikipedia.org/wiki/San_Eustaquio_(desambiguación),
11,6,Beato Federico Cobo Sanz,40,"El Beato Federico Cobo Sanzes recordado como uno de los mártires de la persecución religiosa en España durante los años 1934 a 1937. Este periodo fue caracterizado por una intensa violencia contra la Iglesia Católica. Federico, junto con otros 497 mártires, fue beatificado el 28 de octubre de 2007 en una ceremonia presidida por el Papa Benedicto XVI en Roma. Federico perteneció a la Sociedad de San",federico_cobo_sanz.jpg,https://es.wikipedia.org/wiki/Rábano_(Valladolid),
11,6,Beato Federico Herrera Bermejo,40,"El Beato Federico Herrera Bermejoes recordado como uno de los mártires de la persecución religiosa en España entre 1934 y 1937. Fue beatificado junto con otros 497 mártires el 28 de octubre de 2007 en Roma por el Papa Benedicto XVI. Su celebración se lleva a cabo el 6 de noviembre. Federico Herrera Bermejo, miembro de la Orden de Frailes Menores, vivió en una época de intensa persecución religiosa.",federico_herrera_bermejo.jpg,https://es.wikipedia.org/wiki/Juan_José_Arévalo,
11,6,Beato Felipe Barba Chamorro,40,"El Beato Felipe Barba Chamorroes un símbolo de la fe y la resistencia durante la persecución religiosa en España, que tuvo lugar entre 1934 y 1937. Fue beatificado el 28 de octubre de 2007 por el Papa Benedicto XVI, en una ceremonia celebrada en Roma, junto a otros 497 mártires. Felipe Barba Chamorro, miembro de la Orden de San Agustín, es conmemorado cada 6 de noviembre. Su vida y martirio son un ",felipe_barba_chamorro.jpg,https://es.wikipedia.org/wiki/Guam,
11,6,Beato Félix Alonso Muñiz,40,"El Beato Félix Alonso Muñizes recordado por su valentía y fe inquebrantable durante la persecución religiosa en España entre 1934 y 1937. Fue beatificado junto a otros 497 mártires el 28 de octubre de 2007 por el Papa Benedicto XVI en Roma. Félix Alonso Muñiz formaba parte de la Orden de Predicadores, conocida por su compromiso con la enseñanza y la evangelización. Su vida y su sacrificio son un te",,https://es.wikipedia.org/wiki/La_antorcha_encendida,
11,6,Beato Félix de la Virgen del Carmen,40,"El Beato Félix de la Virgen del Carmen, nacido como Luis Gómez de Pablo, es uno de los mártires de la persecución religiosa en España durante los años 1934 a 1937. Este trágico período fue marcado por una intensa violencia contra los religiosos, quienes defendían su fe a pesar de las adversidades. Fue beatificado el 28 de octubre de 2007 en Roma por el Papa Benedicto XVI, junto a otros 497 mártire",felix_de_la_virgen_del_carmen.jpg,https://es.wikipedia.org/wiki/Virgen_del_Carmen,
11,6,Beato Félix Echevarría Gorostiaga,40,"El Beato Félix Echevarría Gorostiagaes recordado como un mártir de la persecución religiosa en España durante los años 1934 a 1937. Fue beatificado el 28 de octubre de 2007 por el Papa Benedicto XVI, junto con otros 497 mártires. Félix Echevarría, perteneciente a la Orden de Frailes Menores, dedicó su vida a la fe y al servicio de los necesitados. Su valentía y devoción son un ejemplo de compromiso",felix_echevarria_gorostiaga.jpg,https://es.wikipedia.org/wiki/498_mártires_españoles,
11,6,Beato Félix Gómez-Pinto Piñero,40,"El Beato Félix Gómez-Pinto Piñero es recordado por su valentía y fe inquebrantable durante la persecución religiosa que tuvo lugar en España entre 1934 y 1937. Formó parte del grupo de 498 mártires que fueron beatificados por el Papa Benedicto XVI el 28 de octubre de 2007 en Roma. Su memoria se celebra cada 6 de noviembre, destacando su legado de resistencia y devoción. La beatificación de Félix G",felix_gomez_pinto_pinero.jpg,https://es.wikipedia.org/wiki/Lope_de_Vega,
11,6,Beato Félix González Bustos,40,"El Beato Félix González Bustosfue uno de los mártires de la persecución religiosa en España entre 1934 y 1937. Su sacrificio, junto al de otros 497 mártires, fue reconocido por la Iglesia Católica, siendo beatificado el 28 de octubre de 2007 por el Papa Benedicto XVI. Félix González Bustos dedicó su vida a la fe cristiana durante un periodo de intensa persecución religiosa en España. Su valentía y ",felix_gonzalez_bustos.jpg,https://es.wikipedia.org/wiki/Félix_Alonso_González,
11,6,Beato Félix González Tejedor,40,"El Beato Félix González Tejedores recordado como uno de los mártires de la persecución religiosa en España entre 1934 y 1937. Su beatificación, junto a otros 497 mártires, tuvo lugar el 28 de octubre de 2007 en Roma, presidida por el Papa Benedicto XVI. Félix pertenecía a la Sociedad de San Francisco de Sales y dedicó su vida a la fe cristiana. Durante una época de intensa persecución religiosa, mo",,https://es.wikipedia.org/wiki/María_Luisa_Ponte,
11,6,Beato Félix José,40,"El Beato Félix José, nacido como José Trilla Lastra, fue uno de los mártires de la persecución religiosa en España entre 1934 y 1937. Su valentía y fe inquebrantable lo llevaron a ser beatificado por el Papa Benedicto XVI el 28 de octubre de 2007 en Roma, junto con otros 497 mártires. Félix José pertenecía a los Hermanos de las Escuelas Cristianas, una orden dedicada a la enseñanza y al servicio re",felix_jose.jpg,https://es.wikipedia.org/wiki/José_Félix_Ribas,
11,6,Beato Félix León,40,"El Beato Félix León, cuyo nombre secular era Félix Ayúcar Eraso, es un testimonio significativo de la fe cristiana durante la persecución religiosa en España entre 1934 y 1937. Fue beatificado por el Papa Benedicto XVI el 28 de octubre de 2007 junto a otros 497 mártires. Félix León pertenecía a laSociedad de Maríay destacó por su firmeza en la fe durante tiempos de intensa opresión religiosa. Su fe",,https://es.wikipedia.org/wiki/San_Félix,
11,6,Beato Félix Maroto Moreno,40,El Beato Félix Maroto Morenoes recordado como uno de los mártires de la persecución religiosa en España durante los años 1934 a 1937. Fue beatificado junto a otros 497 mártires el 28 de octubre de 2007 por el Papa Benedicto XVI en Roma. Félix Maroto Moreno nació y vivió en una época de intensas tensiones religiosas y políticas en España. Su vida fue un testimonio de fe en medio de la adversidad. La,felix_maroto_moreno.jpg,https://es.wikipedia.org/wiki/Primera_guerra_carlista,
11,6,Beato Félix Paco Escartín,40,"El Beato Félix Paco Escartínes reconocido por su valiente testimonio de fe durante la persecución religiosa en España entre 1934 y 1937. Fue beatificado junto a otros 497 mártires el 28 de octubre de 2007 en Roma por el Papa Benedicto XVI. Félix Paco Escartín, miembro de la Sociedad de San Francisco de Sales, entregó su vida en defensa de su fe en un periodo turbulento de la historia española. Su b",,https://es.wikipedia.org/wiki/Real_Madrid_Club_de_Fútbol,
11,6,Beato Fernando Español,40,"El Beato Fernando Españoles recordado como uno de los mártires de la persecución religiosa en España, que tuvo lugar entre 1934 y 1937. Su vida y sacrificio son un testimonio de fe y valentía en tiempos de gran dificultad para los cristianos. Fue beatificado el 28 de octubre de 2007 en Roma por el Papa Benedicto XVI, junto a otros 497 mártires que sufrieron durante la misma persecución. La festivid",fernando_espanol.jpg,https://es.wikipedia.org/wiki/Fernando_III_de_Castilla,
11,6,Beato Fernando M. Llovera Puigsech,40,"El Beato Fernando M. Llovera Puigseches recordado por su martirio durante la persecución religiosa en España, entre 1934 y 1937. Fue beatificado junto con otros 497 mártires el 28 de octubre de 2007 en Roma por el Papa Benedicto XVI. Su festividad se celebra el6 de noviembre, recordando su valentía y entrega a la fe. Perteneciente a la Orden del Carmelo, el Beato Fernando fue un firme defensor de s",,,
11,6,Beato Florencio Alonso Ruiz,40,"El Beato Florencio Alonso Ruizes recordado por su valentía y fe durante la persecución religiosa en España que tuvo lugar entre 1934 y 1937. Beatificado el 28 de octubre de 2007 en Roma por el Papa Benedicto XVI, Florencio es uno de los 498 mártires que dieron su vida por su fe durante este turbulento periodo. Florencio Alonso Ruiz pertenecía a la Orden de San Agustín y fue uno de los muchos religi",florencio_alonso_ruiz.jpg,https://es.wikipedia.org/wiki/Alonso_Berruguete,
11,6,Beato Florencio Arnaiz Cejudo,40,"El Beato Florencio Arnaiz Cejudoes recordado por su heroica fe durante la persecución religiosa en España entre 1934 y 1937. Nacido en el siglo XX, su dedicación y sacrificio por la fe católica le llevaron a ser beatificado el 28 de octubre de 2007 por el Papa Benedicto XVI. Florencio fue miembro de la Compañía de María, una orden religiosa comprometida con el servicio y la educación cristiana. Dur",,,
11,6,Beato Florencio Miguel,40,"El Beato Florencio Miguel, también conocido como Ruperto García Arce, es recordado como mártir de la persecución religiosa en España durante los años 1934 a 1937. Su valentía y fe inquebrantable lo llevaron a ser beatificado el 28 de octubre de 2007 por el Papa Benedicto XVI en una ceremonia multitudinaria celebrada en Roma. Florencio Miguel nació en España y formó parte de los Hermanos de las Escu",florencio_miguel.png,https://es.wikipedia.org/wiki/Miguel_Febres_Cordero,
11,6,Beato Florencio Rodríguez Guemes,40,"El Beato Florencio Rodríguez Guemes, mártir de la persecución religiosa en España, es recordado por su firmeza en la fe durante los difíciles años de 1934 a 1937. Fue beatificado el 28 de octubre de 2007 por el Papa Benedicto XVI en una ceremonia que honró a 497 mártires. Florencio, miembro de la Sociedad de San Francisco de Sales, vivió en una época de intensa persecución religiosa en España. Su v",florencio_rodriguez_guemes.png,https://es.wikipedia.org/wiki/Partido_de_Florencio_Varela,
11,6,Beato Fortunato Andrés,40,"El Beato Fortunato Andrés, cuyo nombre de nacimiento fue Fortunto Ruiz Peña, es recordado por su valentía durante la persecución religiosa en España entre 1934 y 1937. Fue beatificado junto con otros 497 mártires el 28 de octubre de 2007 en Roma por el Papa Benedicto XVI. Fortunato Andrés fue miembro de la Sociedad de María, dedicando su vida al servicio religioso y a la comunidad cristiana. Durant",,https://es.wikipedia.org/wiki/Pange_lingua,
11,6,Beato Fortunato Arias Sánchez,40,"El Beato Fortunato Arias Sánchez, nacido en España, es recordado por su sacrificio durante la persecución religiosa entre 1934 y 1937. Su valentía y fe inquebrantable lo llevaron a ser beatificado el 28 de octubre de 2007 por el Papa Benedicto XVI en Roma, junto a otros 497 mártires. La beatificación de Fortunato Arias es un testimonio de su devoción y del sufrimiento que soportó durante uno de lo",fortunato_arias_sanchez.jpg,https://es.wikipedia.org/wiki/Fortunato_Arias,
11,6,Beato Fortunato Merino Vegas,40,"El Beato Fortunato Merino Vegas es recordado como un mártir valiente que sufrió durante la persecución religiosa en España entre 1934 y 1937. Beatificado el 28 de octubre de 2007 por el Papa Benedicto XVI, su festividad se celebra el 6 de noviembre. Fortunato Merino Vegas, miembro de la Orden de San Agustín, fue una de las víctimas de la violencia contra los religiosos en España durante los años p",fortunato_merino_vegas.jpg,https://es.wikipedia.org/wiki/Convento_de_San_Agustín_(Málaga),
11,6,Beato Francesc Mayol Oliver,40,El Beato Francesc Mayol Oliveres recordado como un mártir de la persecución religiosa enEspañadurante el turbulento período de 1934 a 1937. Este periodo fue marcado por una intensa violencia contra la Iglesia y sus fieles. Francesc Mayol Oliver fue beatificado junto con otros 497 mártires el28 de octubre de 2007en una ceremonia presidida por el PapaBenedicto XVIen Roma. Esta beatificación fue un re,,https://es.wikipedia.org/wiki/Francesc_Mayol_Oliver,
11,6,Beato Francisco Alfredo,40,"El Beato Francisco Alfredo, cuyo nombre de nacimiento fue Francisco Mallo Sánchez, es recordado como uno de los mártires de la dura persecución religiosa en España entre los años 1934 y 1937. Fue beatificado el 28 de octubre de 2007 en Roma por el Papa Benedicto XVI, junto a otros 497 mártires. Durante el siglo XX, España vivió tiempos convulsos, y muchos religiosos fueron perseguidos y asesinados ",francisco_alfredo.jpg,https://es.wikipedia.org/wiki/Ramón_Alfredo_de_la_Cruz_Baldera,
11,6,Beato Francisco Carlés González,40,"El Beato Francisco Carlés Gonzálezes recordado como uno de los mártires de la persecución religiosa en España entre 1934 y 1937. Su valentía y dedicación a su fe le llevaron a ser beatificado el 28 de octubre de 2007 por el Papa Benedicto XVI en Roma. Durante este periodo, España vivió una intensa persecución religiosa, en la que muchos miembros del clero fueron martirizados por su fe. Francisco Ca",francisco_carles_gonzalez.jpg,https://es.wikipedia.org/wiki/Francisco_González_Macías,
11,6,Beato Francisco Edreira Mosquera,40,"El Beato Francisco Edreira Mosqueranació el 25 de noviembre de 1914 en La Coruña, España. Perteneciente a la Sociedad de San Francisco de Sales, fue víctima de la persecución religiosa en España entre los años 1934 y 1937. Su valentía y fe lo llevaron a ser beatificado junto a otros 497 mártires el 28 de octubre de 2007 en Roma por el Papa Benedicto XVI. Su festividad se celebra el 6 de noviembre. ",,https://es.wikipedia.org/wiki/Real_Club_Deportivo_de_La_Coruña,
11,6,Beato Francisco Fernández Escosura,40,"El Beato Francisco Fernández Escosuraes recordado como uno de los mártires de la persecución religiosa en España entre 1934 y 1937. Fue beatificado el 28 de octubre de 2007 por el Papa Benedicto XVI junto con otros 497 mártires. Su memoria es celebrada cada6 de noviembre. Durante la Guerra Civil Española, muchos religiosos sufrieron persecución por su fe. Francisco Fernández Escosura, perteneciente",francisco_fernandez_escosura.jpg,https://es.wikipedia.org/wiki/Francisco_de_Quevedo,
11,6,Beato Francisco Fuente Puebla,40,"El Beato Francisco Fuente Pueblaes recordado como uno de los mártires de la persecución religiosa en España que ocurrió entre 1934 y 1937. Fue beatificado junto con otros 497 mártires el 28 de octubre de 2007 en Roma por el Papa Benedicto XVI. Francisco Fuente Puebla, un ferviente defensor de su fe, sufrió el martirio durante un tiempo tumultuoso en la historia de España, marcado por la intensa per",francisco_fuente_puebla.jpg,https://es.wikipedia.org/wiki/Iglesia_de_San_Francisco_(Fuente_Obejuna),
11,6,Beato Francisco José Martín López de Arroyave,40,"El Beato Francisco José Martín López de Arroyavees recordado como uno de los mártires de la persecución religiosa en España durante los años 1934 a 1937. Fue beatificado por el Papa Benedicto XVI el 28 de octubre de 2007 en una ceremonia que honró a 498 mártires. Francisco José pertenecía a la Sociedad de San Francisco de Sales, una orden religiosa comprometida con la educación y el servicio a la c",,https://es.wikipedia.org/wiki/Bloque_Capital_de_las_AUC,
11,6,Beato Francisco López-Gasco Fernández-Largo,40,"El Beato Francisco López-Gasco Fernández-Largoes recordado como uno de los mártires de la persecución religiosa en España durante los años 1934 a 1937. Fue beatificado junto con otros 497 mártires el 28 de octubre de 2007 por el Papa Benedicto XVI en Roma. Nacido en Villacañas, Toledo, Francisco López-Gasco dedicó su vida a su fe en un período de intensa persecución religiosa. Fue asesinado en Vill",francisco_lopez_gasco_fernandez_largo.png,https://es.wikipedia.org/wiki/Marquesado_de_Revilla,
11,6,Beato Francisco Magín,40,"El Beato Francisco Magín, nacido Antonio Tost Llavería, es recordado por su valiente testimonio de fe durante la persecución religiosa en España entre 1934 y 1937. Fue uno de los 498 mártires beatificados por el Papa Benedicto XVI el 28 de octubre de 2007 en Roma. Francisco Magín dedicó su vida a la enseñanza y la religión, siendo parte de los Hermanos de las Escuelas Cristianas. Su sacrificio es c",,https://es.wikipedia.org/wiki/Magín_Berenguer,
11,6,Beato Francisco Maqueda López,40,"El Beato Francisco Maqueda Lópezes recordado como un mártir de la persecución religiosa en España durante los años 1934 a 1937, un período marcado por la violencia y la intolerancia hacia la Iglesia Católica. Fue beatificado el 28 de octubre de 2007 en Roma por el Papa Benedicto XVI, junto con otros 497 mártires. Su festividad se celebra el6 de noviembre. Francisco Maqueda López, junto a muchos otr",francisco_maqueda_lopez.png,https://es.wikipedia.org/wiki/Condado_de_Bailén,
11,6,Beato Francisco Marcos del Río,40,"El Beato Francisco Marcos del Ríoes recordado como un mártir de la persecución religiosa que tuvo lugar en España entre 1934 y 1937. Su beatificación, junto a otros 497 mártires, fue llevada a cabo en una ceremonia en Roma por el Papa Benedicto XVI el 28 de octubre de 2007. Francisco Marcos del Río formaba parte de la Orden de San Agustín y su vida fue un testimonio de fe durante tiempos de intensa",francisco_marcos_del_rio.jpg,https://es.wikipedia.org/wiki/Río_San_Francisco_(Brasil),
11,6,Beato Francisco Míguez Fernández,40,El Beato Francisco Míguez Fernándezes recordado como uno de los mártires de la persecución religiosa en España durante los años 1934 a 1937. Fue beatificado el 28 de octubre de 2007 en una ceremonia presidida por el Papa Benedicto XVI en Roma. Francisco Míguez Fernández dedicó su vida a la fe y al servicio dentro de la Sociedad de San Francisco de Sales. Su sacrificio durante el período de persecuc,francisco_miguez_fernandez.jpg,https://es.wikipedia.org/wiki/Francisco_(papa),
11,6,Beato Froilán Lanero Villadangos,40,"El Beato Froilán Lanero Villadangoses conmemorado el 6 de noviembre por su valentía y fe durante la persecución religiosa en España, entre 1934 y 1937. Fue beatificado junto a otros 497 mártires el 28 de octubre de 2007 por el Papa Benedicto XVI en Roma. Nacido en el siglo XX, Froilán formó parte de la Orden de San Agustín, una comunidad religiosa comprometida con la enseñanza y el servicio a los d",,,
11,6,Beato Frumencio,40,"El Beato Frumencio, conocido antes como Julio García Galarza, es un símbolo de la fe cristiana durante la difícil época de la Guerra Civil Española. Fue uno de los muchos que sufrieron la persecución religiosa entre 1934 y 1937. Su beatificación, que tuvo lugar el 28 de octubre de 2007 en Roma, fue un reconocimiento de su sacrificio y devoción. Frumencio perteneció a la Sociedad de María, dedicando",frumencio.jpg,https://es.wikipedia.org/wiki/Frumencio_de_Etiopía,
11,6,Beato Gabino Olaso Zabala,40,"El Beato Gabino Olaso Zabala, mártir de la persecución religiosa en España entre 1934 y 1937, es recordado por su inquebrantable fe y valentía. Beatificado el 28 de octubre de 2007 por el Papa Benedicto XVI, Gabino pertenece a la Orden de San Agustín, una comunidad dedicada a la enseñanza y la caridad. La beatificación de Gabino junto con otros 497 mártires destaca su sacrificio durante una época ",gabino_olaso_zabala.jpg,https://es.wikipedia.org/wiki/Mártires_españoles_del_siglo_XX,
11,6,Beato Gabriel de la Anunciación,40,"El Beato Gabriel de la Anunciaciónes un mártir de la persecución religiosa en España, acontecida entre 1934 y 1937. Fue beatificado junto a otros 497 mártires el 28 de octubre de 2007 por el Papa Benedicto XVI en Roma. Durante la persecución religiosa en España, muchas personas sufrieron por su fe. Gabriel, perteneciente a la Orden del Carmelo, se mantuvo firme en sus creencias hasta el final. La c",gabriel_de_la_anunciacion.jpg,https://es.wikipedia.org/wiki/Anunciación,
11,6,Beato Gabriel Eduardo,40,"El Beato Gabriel Eduardo, conocido en el mundo como Segismundo Hidalgo Martínez, fue uno de los mártires de la persecución religiosa en España entre 1934 y 1937. Beatificado por el Papa Benedicto XVI el 28 de octubre de 2007 en Roma, Gabriel es recordado por su firmeza en la fe y su sacrificio. Durante el siglo XX, España vivió uno de los periodos más convulsos en cuanto a la persecución religiosa.",gabriel_eduardo.jpg,https://es.wikipedia.org/wiki/Eduardo_Santos_Montejo,
11,6,Beato Gaudencio,40,"El Beato Gaudencio, conocido en vida como Juan Tubau Perelló, es recordado como un mártir valiente durante la persecución religiosa en España entre 1934 y 1937. Fue beatificado por el Papa Benedicto XVI el 28 de octubre de 2007 junto con otros 497 mártires. Gaudencio pertenecía a la Sociedad de María, dedicando su vida a la fe y la educación cristiana en tiempos difíciles. La vida y el sacrificio d",gaudencio.jpg,https://es.wikipedia.org/wiki/Gaudencio_de_Novara,
11,6,Beato Gerardo Gil Leal,40,"El Beato Gerardo Gil Leales recordado por su valentía y fe durante la persecución religiosa en España entre 1934 y 1937. Fue beatificado junto a otros 497 mártires por el Papa Benedicto XVI el 28 de octubre de 2007 en Roma. Durante la guerra civil española, muchos religiosos sufrieron persecuciones debido a su fe. Gerardo Gil Leal, perteneciente a la Orden de San Agustín, es uno de esos valientes q",gerardo_gil_leal.png,https://es.wikipedia.org/wiki/Pobre_niña_rica,
11,6,Beato Gerardo Pascual Mata,100,"El Beato Gerardo Pascual Mataes recordado por su valentía y fe inquebrantable durante la persecución religiosa en España entre 1934 y 1937. Beatificado el 28 de octubre de 2007 por el Papa Benedicto XVI en Roma, forma parte de un grupo de 498 mártires reconocidos por su sacrificio durante este turbulento periodo. Gerardo fue miembro de la Orden de San Agustín, conocido por su devoción y compromiso ",gerardo_pascual_mata.jpg,https://es.wikipedia.org/wiki/Marta_Mata,
11,6,Beato Germán Caballero Atienza,40,El Beato Germán Caballero Atienzaes recordado por su firmeza en la fe durante la persecución religiosa en España entre 1934 y 1937. Fue beatificado junto a otros 497 mártires el 28 de octubre de 2007 por el Papa Benedicto XVI en Roma. Germán Caballero fue parte de un grupo de mártires que sufrieron durante un periodo de intensa persecución religiosa en España. Su resistencia y testimonio de fe son ,german_caballero_atienza.png,https://es.wikipedia.org/wiki/Orden_Teutónica,
11,6,Beato Germán Martín Martín,40,"El Beato Germán Martín Martínes recordado por su valentía y fe inquebrantable durante la persecución religiosa en España entre 1934 y 1937. Fue beatificado junto a otros 497 mártires el 28 de octubre de 2007 en Roma por el Papa Benedicto XVI. Germán Martín pertenecía a la Sociedad de San Francisco de Sales. Durante los años de la Guerra Civil Española, muchos religiosos sufrieron persecución por su",german_martin_martin.png,https://es.wikipedia.org/wiki/Club_Atlético_San_Martín_(Tucumán),
