mes,dia,nombre,prioridad,descripcion,imagen,url_wikipedia,oracion
11,1,Todos los Santos,100,"La Festividad de Todos los Santos se celebra el 1 de noviembre. Esta fecha es un homenaje a aquellos que han alcanzado la santidad, pero cuyos nombres no son conocidos. Es un recordatorio de que todos estamos llamados a la santidad. Originalmente, la Iglesia tenía un día dedicado a los mártires. El Papa Bonifacio IV transformó un templo griego en un lugar de culto para 'Todos los Santos'. En el año 8",todos_los_santos.jpg,https://es.wikipedia.org/wiki/D%C3%ADa_de_Todos_los_Santos,
11,1,Beato Nonio Alvarez Pereira,40,"El Beato Nonio Álvarez Pereira, nacido en el siglo XV, es una figura destacada en la historia de Portugal. Inicialmente, fue un noble comprometido con la defensa del reino, desempeñando un papel clave en la consolidación del país. Después de su vida militar, Nonio se unió a la Orden del Carmelo como hermano oblato, adoptando una vida de pobreza y devoción. Su legado incluye un profundo compromiso ",nonio_alvarez_pereira.jpg,https://es.wikipedia.org/wiki/Nuno_Álvares_Pereira,
11,1,Beato Rainiero Aretino,40,"El Beato Rainiero Aretino, miembro de la Orden de los Hermanos Menores, vivió en el siglo XIV y es recordado por sus virtudes de humildad y paciencia. Su vida en Borgo Santo Sepolcro, en la actual Italia, fue un testimonio de dedicación franciscana, abrazando la pobreza y sirviendo como modelo de devoción y fe. Rainiero nació en Arezzo y pronto se unió a la orden franciscana, dedicando su vida a lo",rainiero_aretino.jpg,https://es.wikipedia.org/wiki/Raniero_de_Sansepolcro,
11,1,Beato Ruperto Mayer,40,"El Beato Ruperto Mayeres recordado como un valiente sacerdote jesuita que defendió la fe cristiana durante el régimen nazi en Alemania. Nacido en Munich, dedicó su vida a la comunidad como un ferviente predicador y apoyo de los pobres y trabajadores. Mayer fue perseguido por su oposición al régimen nazi, siendo primero deportado a un campo de concentración y más tarde recluido en un monasterio, inc",ruperto_mayer.jpg,https://es.wikipedia.org/wiki/Rupert_Mayer,
11,1,Beato Teodoro Jorge Romzsa,40,"El Beato Teodoro Jorge Romzsaes un símbolo de devoción y coraje, conocido por su firmeza en la fe durante las difíciles épocas de persecución en el siglo XX. Nacido el 14 de abril de 1911 en Velikij Bychkiv, Ucrania, fue ordenado obispo de Mukacevo en un periodo de agitación religiosa y política. Durante su episcopado, el Beato Teodoro defendió infatigablemente la fe católica frente a la opresión c",,https://es.wikipedia.org/wiki/Teodoro,
11,1,San Audomaro de Théouranne,50,"San Audomaro, conocido por su dedicación a la renovación de la fe cristiana en Flandes, nació en el siglo VII. Como discípulo de san Eustasio de Luxeuil, fue elegido obispo de los Marinos y trabajó incansablemente para reforzar la fe en Théouranne, en la actual Holanda. Su legado perdura a través de las comunidades cristianas que ayudó a consolidar. Cada 1 de noviembre, su vida y obra son celebrad",audomaro_de_theouranne.jpg,https://es.wikipedia.org/wiki/Audomar_de_Thérouanne,
11,1,San Austremonio de Avernia,50,"San Austremonio de Avernia es venerado como el primer obispo de Clermont-Ferrand, en la moderna región de Auvernia, Francia. Según la tradición, fue uno de los primeros en predicar el cristianismo en esta área, llevando la palabra de salvación a sus habitantes. Su festividad se celebra el 1 de noviembre, un día que marca su contribución al crecimiento espiritual de la región. Se cree que San Austr",austremonio_de_avernia.jpg,https://es.wikipedia.org/wiki/Austremonio,
11,1,San Benigno de Dijón,50,"San Benigno de Dijon, un destacado presbítero y mártir del cristianismo, es recordado por su entrega y devoción en la Galia Lugdunense. Su festividad se celebra el1 de noviembre, un día para honrar su sacrificio y compromiso con la fe cristiana. San Benigno es una figura central entre los santos de nombre Benigno, que también incluyen a San Benigno de Milán y San Benigno de Todi. La devoción hacia",benigno_de_dijon.jpg,https://es.wikipedia.org/wiki/Benigno_de_Dijon,
11,1,San Cesáreo de Tarracina,50,"San Cesáreo de Tarracina, conocido por su martirio en la costa del Lacio durante el siglo I, es celebrado cada 1 de noviembre. Su historia es un testimonio de fe inquebrantable y dedicación a la causa cristiana. San Cesáreo vivió en una época de persecución contra los cristianos, y su compromiso con la fe le llevó al martirio. Aunque los detalles específicos de su vida son escasos, se le recuerda ",,https://es.wikipedia.org/wiki/San_Cesáreo,
11,1,San Licinio de Anjou,50,"San Licinio de Anjou, celebrado el1 de noviembre, fue un destacado obispo del siglo VII en la región de Neustria, hoy conocida como Francia. Su devoción y liderazgo espiritual lo hicieron merecedor de la confianza del papa Gregorio I Magno, quien le encomendó la importante misión de guiar a los monjes que se dirigían a Inglaterra. San Licinio vivió en una época de grandes cambios dentro de la Igle",licinio_de_anjou.jpg,https://es.wikipedia.org/wiki/Licinio_de_Angers,
11,1,San Magno de Milán,50,"San Magno de Milán es venerado como un santo y obispo del siglo VI. Su liderazgo en la Iglesia de Milán dejó una marca significativa en la comunidad cristiana de la época. Celebramos su festividad el1 de noviembre, recordando su dedicación y piedad. San Magno asumió el cargo de obispo en una época de desafíos para la Iglesia. Su sabiduría y fortaleza espiritual guiaron a los fieles a través de tie",magno_de_milan.jpg,https://es.wikipedia.org/wiki/Magno_de_Milán,
11,1,San Marcelo de París,50,"San Marcelo de París, cuyo liderazgo espiritual marcó el siglo IV, es conocido por su contribución a la difusión del cristianismo en la Galia Lugdunense.Su festividad se celebra el 1 de noviembre, un día en que los fieles recuerdan su devoción y compromiso con la iglesia. Como obispo, San Marcelo jugó un papel crucial en el establecimiento de la iglesia en París, enfrentando desafíos tanto interno",marcelo_de_paris.jpg,https://es.wikipedia.org/wiki/Marcelo_de_París,
11,1,San Maturino de Larchant,50,"San Maturino de Larchant es recordado como unpresbítero y confesorque vivió en el siglo VII en Larchant, una ciudad del Gatinais Aquitano. Su vida de devoción y servicio lo llevó a ser venerado como santo, y su festividad se celebra el1 de noviembre. San Maturino dedicó su vida a la fe cristiana, sirviendo a su comunidad como presbítero. Su legado perdura a través de los siglos, siendo un ejemplo ",maturino_de_larchant.jpg,https://es.wikipedia.org/wiki/Maturino_de_Larchant,
11,1,San Pedro del Barco,50,"San Pedro del Barco, nacido en el siglo XII en El Barco, Ávila, es reconocido por su profunda vida de retiro espiritual. Vivió como eremita a orillas del río Tormes, dedicando su vida a la oración y la meditación. Su fiesta se celebra el1 de noviembre, recordando su tránsito a la vida eterna en 1155. San Pedro es un ejemplo de devoción y austeridad, optando por la soledad para acercarse más a Dios",pedro_del_barco.png,https://es.wikipedia.org/wiki/El_Barco_de_Ávila,
11,1,San Rómulo de Bourges,50,"San Rómulo de Bourges, recordado el 1 de noviembre, fue un destacadoabad y sacerdotedel siglo V en la ciudad de Bourges, Aquitania. Conocido por su devoción y liderazgo espiritual, Rómulo dejó una marca indeleble en la comunidad cristiana de su tiempo. En el contexto del siglo V, un período marcado por la consolidación del cristianismo, San Rómulo desempeñó un papel crucial como líder espiritual e",,https://es.wikipedia.org/wiki/1_de_noviembre,
11,1,San Severino de Tívoli,50,"San Severino de Tívolies un santo venerado en la tradición cristiana, especialmente conocido por su vida austera en el siglo VI. Vivió como monje en la región del Lacio, en Italia, dedicando su vida a la oración y la contemplación. San Severino es celebrado el1 de noviembre, una fecha que coincide con la festividad de Todos los Santos. A lo largo de los siglos, ha sido una figura inspiradora para ",,https://es.wikipedia.org/wiki/San_Severino,
11,1,San Vigor de Bayeux,50,"San Vigor de Bayeux, nacido en el siglo VI, es reconocido como un ferviente obispo en la Galia Lugdunense. Como discípulo de San Vedasto, su vida se destacó por su dedicación a la fe cristiana y su liderazgo espiritual en la región. Su festividad se celebra el 1 de noviembre, una fecha que lo vincula con otras conmemoraciones de santos en el calendario litúrgico. Durante su episcopado, San Vigor t",vigor_de_bayeux.jpg,https://es.wikipedia.org/wiki/Vigor_de_Bayeux,
11,1,Santa Cirenia mártir,50,"Santa Cirenia es una mártir cristiana conocida por su firmeza y amor por la fe. Su memoria se honra el1 de noviembre, una fecha que destaca en el calendario litúrgico. A pesar de las adversidades, su devoción y sacrificio han sido fuente de inspiración para muchos. La historia de Santa Cirenia resalta la fortaleza de quienes defendieron su fe a lo largo de la historia cristiana, recordándonos la i",cirenia_martir.jpg,https://es.wikipedia.org/wiki/María_de_la_Luz_Cirenia_Camacho_González,
11,2,Todos los fieles difuntos,25,"ElDía de los Fieles Difuntos, celebrado el 2 de noviembre, es una fecha especial en la que los cristianos recuerdan a aquellos que han partido con el signo de la fe. Este día es una oportunidad para ofrecer oraciones y buenas obras para el perdón y la purificación de sus almas. La oración es un acto poderoso que los vivos podemos realizar para ayudar a los difuntos a conseguir la salvación. A menu",todos_los_fieles_difuntos.jpg,https://es.wikipedia.org/wiki/Día_de_los_Fieles_Difuntos,
11,2,Beata Margarita de Lorena,40,"La Beata Margarita de Lorena, nacida en el siglo XVI, es recordada por su devoción y transformación de duquesa a religiosa. Tras la muerte de su esposo, el duque de Alençon, Margarita decidió dedicar su vida a Dios. Fundó un monasterio de Clarisas en Argentan, Normandía, donde vivió hasta su muerte el 2 de noviembre de 1521. Margarita nació en una noble familia y se casó con el duque de Alençon. Su",margarita_de_lorena.jpg,https://es.wikipedia.org/wiki/Lorena_Velázquez,
11,2,Beato Juan Bodey,40,"El Beato Juan Bodeyes recordado como un mártir intrépido que defendió su fe católica durante el turbulento reinado de Isabel I en Inglaterra. Nacido en el siglo XVI, Bodey trabajaba como maestro de escuela cuando fue arrestado por rechazar la autoridad espiritual de la reina. Fue condenado a muerte y ejecutado el 2 de noviembre de 1583 en Aodover, Hampshire. Juan Bodey nació en un tiempo de gran te",,https://es.wikipedia.org/wiki/2_de_noviembre,
11,2,Beato Pío Campidelli,40,"El Beato Pío Campidellinació el 29 de abril de 1869 en Romagna, Italia. Perteneció a la Congregación de la Pasión, dedicando su corta vida a la espiritualidad y el servicio. Falleció el 2 de noviembre de 1889 en Casale, Italia, afectado por una grave enfermedad, pero en plena conformidad con la voluntad divina. Fue beatificado por el Papa Juan Pablo II el 17 de noviembre de 1985, y su festividad se",pio_campidelli.jpg,https://es.wikipedia.org/wiki/Pío_de_San_Luis,
11,2,San Acindino y compañeros,50,"San Acindino y sus compañeros mártires son recordados por su sacrificio y fe inquebrantable durante el siglo IV en Persia. Bajo el reinado de Sapor II, estos valientes cristianos enfrentaron la persecución por defender su fe.Acindino, junto con Pegasio, Aftonio, Epidíforo, Anempodisto y otros, son honrados por su resistencia y devoción. En una época de intensa persecución, estos santos se mantuvie",,https://es.wikipedia.org/wiki/Acindino,
11,2,San Agauno abad,50,"San Agauno, cuyo recuerdo se celebra cada 2 de noviembre, fue un abad conocido por su profunda fe y liderazgo espiritual. Su vida y obra han inspirado a muchos a través de los siglos. San Agauno dedicó su vida al servicio religioso, guiando a su comunidad con sabiduría y compasión. Su legado perdura en las enseñanzas y tradiciones que dejó. El 2 de noviembre es una fecha especial para honrar su me",agauno_abad.jpg,https://es.wikipedia.org/wiki/Abadía_territorial_de_San_Mauricio,
11,2,San Ambrosio de Agauno,50,"San Ambrosio de Agauno, cuyo día de celebración es el2 de noviembre, fue un destacado abad delsiglo VI. Nació en la región que hoy conocemos como Suiza, en el monasterio de Agauno, donde se le recuerda por su ejemplar observancia religiosa. Inicialmente, San Ambrosio fue padre del monasterio de la isla Bárbara, cerca de Lyon. Su reputación por su devoción y piedad lo llevó a ser trasladado a Agaun",ambrosio_de_agauno.jpg,https://es.wikipedia.org/wiki/Abadía_territorial_de_San_Mauricio,
11,2,San Carterio de Sebaste y compañeros,50,"En el siglo IV, durante el reinado del emperador Licinio, un grupo de soldados cristianos, encabezados por San Carterio, Estiriaco, Tobías, Eudoxio y Agapio, fueron martirizados en Sebaste, Armenia. A pesar de las severas persecuciones, estos valientes permanecieron firmes en su fe. La tradición relata que fueron arrojados a las llamas por negarse a renunciar a Cristo. La festividad de San Carteri",,https://es.wikipedia.org/wiki/2_de_noviembre,
11,2,San Ernino anacoreta,50,,,,
11,2,San Jorge de Viennes,50,"San Jorge de Viennes fue un distinguido obispo de Burgundia en el siglo VII. Aunque los detalles sobre su vida son escasos, se le reconoce por su liderazgo espiritual en Viennes, Francia. Su festividad se celebra el2 de noviembre, recordando su legado en la región. San Jorge comparte su nombre con varios otros santos, incluyendo San Jorge de Antioquía y San Jorge de Lesbos, pero su contribución es",,https://es.wikipedia.org/wiki/San_Jorge_(desambiguación),
11,2,San Justo de Trieste,50,"San Justo de Trieste es recordado como un mártir cristiano del siglo IV. Su festividad se celebra el 2 de noviembre. Fue un ferviente defensor de la fe cristiana en tiempos de persecución. Su valentía y sacrificio han dejado una huella imborrable en la comunidad cristiana. Nacido en Trieste, San Justo vivió durante un periodo de intensa persecución contra los cristianos. Fue martirizado por su fir",,https://es.wikipedia.org/wiki/Justo_de_Trieste,
11,2,San Malaquías de Armagh,50,"San Malaquías de Armagh fue un destacado obispo irlandés del siglo XII cuya obra principal fue la revitalización de la Iglesia en Irlanda. Nació en el área que hoy conocemos como Irlanda y dedicó su vida a restaurar la vida eclesiástica en su país natal. Malaquías, cuyo nombre de nacimiento fue Maelmhaedhoc O’Morgair, trabajó incansablemente para mejorar las estructuras y prácticas de la Iglesia. ",malaquias_de_armagh.jpg,https://es.wikipedia.org/wiki/Malaquías_de_Armagh,
11,2,San Marciano de Calcedonia,50,"San Marciano de Calcedonia, celebrado el2 de noviembre, fue un eremita del siglo IV. Nacido en Cirro, se retiró al desierto de Calcedonia, donde llevó una vida austera. Vivía en una pequeña cabaña, alimentándose solo de una modesta cantidad de pan y agua al atardecer, poniendo siempre el amor fraterno por delante del ayuno. Su vida es un ejemplo de devoción y sencillez, recordado por su dedicación",marciano_de_calcedonia.jpg,https://es.wikipedia.org/wiki/Eufemia_de_Calcedonia,
11,2,San Victorino de Pettau,50,"San Victorino de Pettau, recordado el2 de noviembre, fue un destacado obispo en Panonia, hoy Eslovenia. Famoso por sus escritos bíblicos, fue martirizado durante las persecuciones del emperador Diocleciano alrededor del año 303. Victorino se distinguió por su habilidad para interpretar las Escrituras Sagradas, contribuyendo significativamente a la teología cristiana primitiva. En una época de inte",,https://es.wikipedia.org/wiki/Nicolaítas,
11,2,Santa Margarita de Lorena,50,"Santa Margarita de Lorena, conocida por su profunda espiritualidad, vivió en el siglo XVI. Tras enviudar, dedicó su vida al servicio religioso, convirtiéndose en monja. Su legado de fe y dedicación es celebrado cada 2 de noviembre. Margarita nació en Lorena, actualmente parte de Francia, y es reconocida por su papel como madre, monja y viuda. A lo largo de su vida, mostró una fuerte devoción relig",margarita_de_lorena.jpg,https://es.wikipedia.org/wiki/Lorena_Velázquez,
11,2,Santa Winefrida de Holywell,50,"Santa Winefrida, una monja venerada del siglo VII, es recordada por su devoción y vida ejemplar en Holywell, Cambria. Se celebra su festividad el2 de noviembre. La fuente de Holywell es un lugar de peregrinación asociado a milagros atribuidos a su intercesión. Winefrida nació en una familia noble y decidió dedicar su vida a Dios, ingresando en la vida monástica. Su fama de santidad se extendió ráp",winefrida_de_holywell.jpg,https://es.wikipedia.org/wiki/Winifreda_de_Gales,
11,3,San Martín de Porres,50,"San Martín de Porres es una figura emblemática de la caridad cristiana. Nacido el 9 de diciembre de 1579 en Lima, Perú, fue hijo de un hidalgo español y una mujer de raza negra. Desde joven, se destacó por su habilidad como barbero, oficio que le permitió ayudar a los más necesitados. Su humildad y dedicación lo llevaron a ingresar al convento dominico del Rosario, donde se convirtió en hermano. A",martin_de_porres.jpg,https://es.wikipedia.org/wiki/Martín_de_Porres,
11,3,Beata Alpaide de Cudot,40,"La Beata Alpaide de Cudot, celebrada el3 de noviembre, es un ejemplo de devoción y sacrificio. Nacida en el siglo XIII en Cudot, región de Sens, Francia, Alpaide sufrió crueles heridas y fue abandonada por su familia. Sin embargo, su fe la mantuvo firme, llevándola a vivir en reclusión en una pequeña celda hasta su ancianidad. Alpaide destacó por su fortaleza espiritual, enfrentando el abandono con",,https://es.wikipedia.org/wiki/3_de_noviembre,
11,3,Beato Berardo de los marsos,40,"El Beato Berardo de los Marsos, nacido en Pescina, Italia, en el siglo XII, es recordado por su firme postura contra la simonía y su compromiso con la disciplina clerical. Su vida fue un ejemplo de dedicación a la fe y al bienestar de los más necesitados. Berardo se convirtió en obispo en un momento en que la Iglesia enfrentaba numerosos desafíos. Trabajó incansablemente para reformar y fortalecer",berardo_de_los_marsos.jpg,https://es.wikipedia.org/wiki/Berardo_dei_Marsi,
11,3,Beato Simón Balachi,40,"El Beato Simón Balachies conocido por su ferviente dedicación a la vida religiosa dentro de la Orden de Predicadores. Nacido en el siglo XIV en Rímini, dedicó su vida al servicio de sus hermanos, entregándose a la penitencia y a la oración. Simón Balachi vivió en un tiempo donde la devoción personal y la vida comunitaria eran pilares fundamentales de la fe. Su vida austera y su compromiso religioso",,https://es.wikipedia.org/wiki/3_de_noviembre,
11,3,Beato Simón Ballachi,40,"El Beato Simón Ballachinació y falleció en Rímini, en lo que hoy es Italia. Fue un ferviente miembro de la Orden de Predicadores, conocidos como los dominicos, en el siglo XIV. Su vida estuvo marcada por una profunda humildad y dedicación al servicio de los demás. Simón Ballachi ingresó a la orden dominica, dedicando su vida a la oración, el estudio y el trabajo manual. Su devoción y sencillez lo h",,,
11,3,San Domnino de Vienne,50,"San Domnino de Vienne, cuya festividad se celebra el3 de noviembre, fue un destacado obispo del siglo VI en la región de la Galia Lugdunense, lo que hoy conocemos como Francia. Es recordado especialmente por su compromiso con la redención de cautivos, una causa noble que marcó su episcopado. San Domnino nació y vivió en un tiempo donde la esclavitud y los conflictos eran comunes. Como obispo en Vi",,https://es.wikipedia.org/wiki/Domnino_de_Vienne,
11,3,San Ermengol de Urgel,50,"San Ermengol de Urgel, celebrado el3 de noviembre, fue un influyente obispo en la región de Cataluña durante el siglo XI. Conocido por su dedicación a la reconstrucción de la Iglesia tras la liberación del yugo sarraceno, San Ermengol destacó no solo por su liderazgo espiritual, sino también por su compromiso práctico. Se le recuerda especialmente por su participación directa en la construcción de",ermengol_de_urgel.jpg,https://es.wikipedia.org/wiki/Ermengol_de_Urgel,
11,3,San Gaudioso de Tarazona,50,"San Gaudioso de Tarazona fue un obispo influyente durante el siglo VI. Conocido por su férrea defensa de la fe católica frente a la herejía arriana, desempeñó un papel crucial en la preservación de la doctrina ortodoxa en su tiempo. Este santo es celebrado cada 3 de noviembre, recordado por su dedicación al fortalecimiento de la Iglesia. Discípulo de San Victoriano, Gaudioso fue elegido obispo de ",,https://es.wikipedia.org/wiki/Gaudioso_de_Tarazona,
11,3,San Guenael de Landevenec,50,"San Guenael, celebrado el3 de noviembre, fue un destacado abad de Landevenec en la Bretaña Menor durante el siglo VI. Su vida estuvo marcada por su dedicación a la vida monástica y su influencia en la región bretón. San Guenael es recordado por su liderazgo espiritual y su habilidad para guiar a sus seguidores en tiempos de desafío. Su festividad es un momento para reflexionar sobre sus contribuci",guenael_de_landevenec.jpg,https://es.wikipedia.org/wiki/Gwenhael,
11,3,San Huberto cazador,50,"San Huberto es una figura central en la tradición cristiana, especialmente entre los cazadores, quienes lo veneran como su santo patrono. Su festividad se celebra el3 de noviembre, recordando su vida de fe y dedicación. San Huberto, nacido en el seno de una familia noble, inicialmente fue un ferviente cazador. Sin embargo, su vida cambió radicalmente tras una visión divina mientras cazaba, llevánd",huberto_cazador.jpg,https://es.wikipedia.org/wiki/Huberto_de_Lieja,
11,3,San Juanicio de Antidio,50,"San Juanicio de Antidio es recordado como un devoto monje del siglo IX que, tras más de dos décadas al servicio militar, optó por una vida de soledad y oración en las montañas de la región de Bitinia, en la actual Turquía. Su vida de contemplación y espiritualidad es ejemplo de devoción cristiana. Juanicio, nacido en Bitinia, decidió retirarse del mundo tras una vida de servicio militar. Se asentó",juanicio_de_antidio.jpg,https://es.wikipedia.org/wiki/Juanicio_el_Grande,
11,3,San Libertino de Agrigento,50,"San Libertino de Agrigento fue un destacado obispo y mártir cristiano del siglo IV. Su dedicación a la fe lo llevó a convertirse en un pilar de la comunidad cristiana en Sicilia. Cada 3 de noviembre, los fieles celebran su vida y legado. La historia de San Libertino se sitúa en la región de Agrigento, Sicilia, donde ejerció su labor como obispo. En una época de persecución, Libertino se mantuvo fi",libertino_de_agrigento.jpg,https://es.wikipedia.org/wiki/Libertino_de_Agrigento,
11,3,San Pápulo de Lauragais,50,"San Pápulo de Lauragais es un santo mártir del siglo IV venerado en la Galia Narbonense. Su festividad se celebra el 3 de noviembre. Según la tradición, Pápulo fue un ferviente defensor del cristianismo en una era de persecuciones. Su coraje y dedicación le valieron un lugar especial en el corazón de los fieles. La vida de San Pápulo está envuelta en las leyendas de la época, pero se le recuerda e",,https://es.wikipedia.org/wiki/3_de_noviembre,
11,3,San Pedro Francisco Nerón,50,"San Pedro Francisco Nerónfue un destacado misionero y mártir del siglo XIX, conocido por su incansable fe y sacrificio. Nacido en Francia, se unió a la Sociedad de Misiones Extranjeras de París y llevó su misión a Vietnam, donde enfrentó la persecución bajo el régimen del emperador Tu Duc. Encarcelado durante tres meses en una cueva, Nerón sufrió torturas y se abstuvo de alimento durante semanas. ",,https://es.wikipedia.org/wiki/Pedro_Francisco_de_Lanini,
11,3,San Pirmino de Reichenau,50,"El 3 de noviembre se celebra la festividad deSan Pirmino de Reichenau, recordado por su misión evangelizadora en Europa Central durante los siglos III y IV. Este santo obispo y abad desempeñó un papel crucial en la conversión de los alamanes y bávaros al cristianismo. San Pirmino fundó varios monasterios, donde impartió enseñanzas religiosas y escribió un libro de catequesis para sus discípulos, a",pirmino_de_reichenau.jpg,https://es.wikipedia.org/wiki/Pirmino_de_Reichenau,
11,3,Santa Ida de Fieschingen,50,"Santa Ida de Fieschingenfue una reclusa venerada en el siglo XIII en lo que hoy es Suiza. Su vida de devoción y reclusión cerca del monasterio de Fieschingen la ha hecho un ejemplo de fe y dedicación religiosa. Santa Ida vivió en una época de fervor religioso, optando por una vida de reclusión para dedicarse completamente a la espiritualidad. Su devoción y sacrificio continúan inspirando a muchos.",ida_de_fieschingen.jpg,https://es.wikipedia.org/wiki/Ida_de_Toggenburg,
11,3,Santa Odrada de Alem,50,"Santa Odrada de Alemes conmemorada el 3 de noviembre en Flandes. Vivió en elsiglo XIy es reconocida por su dedicación y vida de santidad. Aunque la información sobre su vida es limitada, su legado perdura en la historia cristiana. La celebración de su festividad en Flandes refleja la importancia de su figura en la comunidad local. Odrada es venerada como un ejemplo de fe y pureza. El legado de San",,https://es.wikipedia.org/wiki/3_de_noviembre,
11,3,Santa Silvia de Sicilia,50,"Santa Silvia de Sicilia es reconocida por ser la madre del Papa San Gregorio I Magno, uno de los padres de la Iglesia. Nació y falleció en Mesina, Sicilia, en el siglo VI. Silvia es celebrada el 3 de noviembre por su devoción y vida ejemplar de oración y penitencia. Según San Gregorio, su madre alcanzó altos niveles de espiritualidad, convirtiéndose en un modelo para su comunidad. Su legado espiri",silvia_de_sicilia.jpg,https://es.wikipedia.org/wiki/Silvia_de_Sicilia,
