mes,dia,nombre,prioridad,descripcion,imagen,url_wikipedia,oracion
11,14,San Teodoto de Heraclea,50,"San Teodoto de Heracleaes conmemorado como un mártir cristiano del siglo III. Su vida es un testimonio de fe y sacrificio en tiempos de persecución. Heraclea, una ciudad en Tracia, fue el lugar donde Teodoto hizo su último sacrificio por su fe cristiana. San Teodoto vivió en una época donde el cristianismo enfrentaba grandes desafíos. A pesar de las adversidades, se mantuvo firme en su fe, lo que ",teodoto_de_heraclea.png,https://es.wikipedia.org/wiki/Metropolitanato_de_Heraclea,
11,14,San Venerando de Troyes,50,"San Venerando de Troyes, celebrado el14 de noviembre, fue un obispo y mártir del siglo III. Su nombre, que significa 'digno de ser venerado', refleja su vida dedicada al servicio de la fe cristiana. Como obispo de Troyes, San Venerando fue conocido por su liderazgo espiritual y su defensa de la fe durante tiempos de persecución. Se le atribuyen varios milagros, y su vida y martirio inspiraron a mu",venerando_de_troyes.jpg,https://es.wikipedia.org/wiki/Catedral_de_Toledo,
11,14,San Vitón,50,"San Vitón, conocido por su servicio como obispo de Verdún, es celebrado cada 14 de noviembre. Su vida estuvo marcada por su compromiso con la fe y su liderazgo en la iglesia. San Vitón nació en una época en la que la expansión del cristianismo era crucial. Como obispo, trabajó incansablemente para fortalecer la fe y guiar a su congregación. El legado de San Vitón perdura en Verdún, donde es record",,https://es.wikipedia.org/wiki/Vitón_de_Verdún,
11,14,Santa Trahamunda de Pontevedra,50,"El 14 de noviembre se celebra aSanta Trahamunda de Pontevedra, conocida por su dedicación religiosa y martirio. Esta santa es recordada por su fe y compromiso con Dios, lo que la llevó a ser reconocida como mártir y virgen. Originaria de Pontevedra, Santa Trahamunda dedicó su vida al servicio religioso. Es conocida por su valentía y devoción, que la llevaron a enfrentar el martirio. Su legado perd",trahamunda_de_pontevedra.jpg,https://es.wikipedia.org/wiki/Trahamunda,
11,15,San Alberto Magno,50,"San Alberto Magno, apodado 'Magno' por su grandeza intelectual, fue un destacado obispo y doctor de la Iglesia durante el siglo XIII. Ingresó en la Orden de Predicadores en París, donde enseñó tanto en filosofía como en teología. Su legado incluye ser maestro de Santo Tomás de Aquino, combinando la sabiduría espiritual con las ciencias humanas y naturales. San Alberto se vio obligado a aceptar la ",alberto_magno.jpg,https://es.wikipedia.org/wiki/Alberto_Magno,
11,15,San Eugenio de Toledo,50,"San Eugenio de Toledo, nacido en el siglo VII, es recordado por su notable contribución tanto a la iglesia como a la literatura de su tiempo. Fue un influyente obispo en Toledo, desempeñando un papel crucial en la consolidación de la fe cristiana en la península ibérica durante la época visigoda. Además de su labor pastoral, Eugenio destacó como poeta y escritor, dejando un legado literario que lo",eugenio_de_toledo.jpg,https://es.wikipedia.org/wiki/Eugenio_de_Toledo,
11,15,Beata Lucía Brocadelli,40,"La Beata Lucía Brocadelli, originaria de Ferrara, Italia, es recordada por su inquebrantable fe y paciencia. Durante el siglo XVI, tanto en su vida matrimonial como en el monasterio de la Tercera Orden de Santo Domingo, Lucía enfrentó y superó muchas dificultades. Lucía Brocadelli vivió en una época de cambios y tribulaciones, dedicando su vida a la oración y al servicio. Su capacidad para soporta",lucia_brocadelli.jpg,https://es.wikipedia.org/wiki/Lucía_de_Narni,
11,15,Beata María de la Pasión de Chappotin,40,"La Beata María de la Pasión, nacida Helena de Chappotin, fue una destacada religiosa del siglo XX. Fundó las Hermanas Franciscanas Misioneras de María, dedicadas al servicio de mujeres en tierras de misión. Su devoción a la humildad y simplicidad de San Francisco la llevó a impactar positivamente en comunidades alrededor del mundo. Nacida el 21 de mayo de 1839 en Nantes, Francia, María fue beatific",,https://es.wikipedia.org/wiki/15_de_noviembre,
11,15,Beato Cayo Coreano,40,"El Beato Cayo Coreanofue un catequista cristiano que vivió en el Japón del siglo XVII. Fue condenado a la hoguera en Nagasaki el 15 de noviembre de 1627, debido a su inquebrantable confesión de fe en Cristo. Cayo Coreano dedicó su vida a la enseñanza del Evangelio en un tiempo de intensa persecución religiosa. Su valentía y dedicación a la fe cristiana lo llevaron a convertirse en mártir, un testim",cayo_coreano.jpg,https://es.wikipedia.org/wiki/Cayo_(nombre),
11,15,San Desiderio de Cahors,50,"San Desiderio de Cahorsfue un destacado obispo en el siglo VII, conocido por su labor en la construcción de iglesias y monasterios en Cahors, Aquitania. Su festividad se celebra el15 de noviembre. San Desiderio dedicó su vida a preparar las almas de los fieles como verdaderos templos de Cristo, dejando un legado que perdura hasta hoy. Su obra no solo se limitó a lo espiritual, sino que también imp",,https://es.wikipedia.org/wiki/Desiderio_de_Cahors,
11,15,San Fidenciano y compañeros,50,"El 15 de noviembre, la Iglesia conmemora a San Fidenciano y sus compañeros mártires de Hipona, en Numidia. Según San Agustín, estos veinte mártires, entre ellos Fidenciano, Valeriana y Victoria, dieron testimonio de su fe en los siglos III y IV.San Fidenciano, siendo obispo, lideró a sus compañeros hacia el martirio, dejando un legado de valentía y devoción. Estos mártires son un ejemplo de la res",,https://es.wikipedia.org/wiki/15_de_noviembre,
11,15,San Fintano de Rheinau,50,"San Fintano de Rheinau es recordado por su vida de reclusión y devoción en el siglo IX. Nacido en Irlanda, se trasladó a Suiza, donde vivió inicialmente en un monasterio. Sin embargo, buscando una conexión más profunda con Dios, se retiró a una pequeña celda junto a la iglesia en Rheinau. Fintano dedicó su vida a la oración y la contemplación, abrazando la soledad como un camino hacia la santidad.",,https://es.wikipedia.org/wiki/15_de_noviembre,
11,15,San Gurias de Edesa,50,"San Gurias de Edesa, junto con su compañero San Samona, es recordado por su firmeza en la fe durante las persecuciones del emperador Diocleciano. Estos santos mártires sufrieron prolongados y crueles tormentos antes de ser condenados a muerte y decapitados por el prefecto Misiano. Gurias y Samona vivieron en Edesa, en la región de Osrhoena. Su sacrificio es un testimonio de la resistencia y devoci",gurias_de_edesa.jpg,https://es.wikipedia.org/wiki/Habib_de_Edesa,
11,15,San José Mkasa Balikuddembé,100,"San José Mkasa Balikuddembées recordado como un valeroso mártir del siglo XIX en Uganda. Nacido en una época de persecución, se convirtió al cristianismo y trabajó en el palacio real, donde defendió a los jóvenes de la corrupción moral del rey Mwenga. Su firme fe y liderazgo lo llevaron a ser ejecutado el 15 de noviembre de 1885, a la edad de 25 años. La festividad de San José Mkasa Balikuddembé s",,https://es.wikipedia.org/wiki/15_de_noviembre,
11,15,San Leopoldo el piadoso,50,"San Leopoldo, nacido en Melk, en la actual Alemania, fue un príncipe austríaco del siglo XII conocido por su devoción religiosa y su compromiso con la paz. Apodado 'el Piadoso', dedicó su vida a obras de caridad y al apoyo del clero. Su festividad se celebra el 15 de noviembre. Leopoldo gobernó con justicia, promoviendo la paz entre sus súbditos y siendo un gran benefactor de los pobres. Fundó el ",leopoldo_el_piadoso.jpg,https://es.wikipedia.org/wiki/Leopoldo_III_de_Austria_(Babenberg),
11,15,San Maclovio de Alet,50,"San Maclovio, también conocido como San Macuto, fue un destacado obispo en Bretaña Menor durante el siglo VII. Nació en Cambria y su legado perdura en la región de Alet, donde ejerció como líder espiritual.San Macloviofalleció en Saintes, Francia, y su festividad se celebra el 15 de noviembre. San Maclovio es conocido por su dedicación a la fe y su liderazgo como obispo. Su vida refleja la fortale",maclovio_de_alet.jpg,https://es.wikipedia.org/wiki/Saint-Malo,
11,15,San Rafael de San José Kalinowski,100,"San Rafael de San José Kalinowskifue un destacado Carmelita Descalzo de Polonia. Nacido como José Kalinowski, su vida estuvo marcada por la resistencia y la fe. Participó en la insurrección polaca y fue encarcelado en Siberia. Tras su liberación, se unió a la Orden de los Carmelitas Descalzos y trabajó incansablemente para su promoción. San Rafael nació en Vilna, en el entonces Imperio Ruso, el 1 ",rafael_de_san_jose_kalinowski.jpg,https://es.wikipedia.org/wiki/Rafael_Kalinowski,
11,15,San Samonas de Edesa,50,"San Samonas de Edesa es recordado como un mártir cristiano del siglo IV. Junto a San Gurias, sufrió crueles tormentos antes de ser decapitado durante la persecución de Diocleciano. Su festividad se celebra el15 de noviembre, recordando su lealtad a la fe cristiana. Durante el reinado de Diocleciano, los cristianos enfrentaron severas persecuciones. San Samonas, un asceta devoto, fue arrestado y to",samonas_de_edesa.jpg,https://es.wikipedia.org/wiki/Habib_de_Edesa,
11,15,San Sidonio de Rouen,50,"San Sidonio de Rouen, oriundo de Irlanda, es celebrado por su profunda dedicación a la vida monástica en el siglo VII. Comenzó su camino espiritual en el monasterio de Jumièges y continuó en Herio, bajo la guía de San Filiberto. Finalmente, fundó el monasterio de Saint-Saens en Rouen, dejando un legado perdurable en la región. Su festividad se celebra el 15 de noviembre. San Sidonio se destacó por",sidonio_de_rouen.png,https://es.wikipedia.org/wiki/Leufredo,
11,16,Santa Margarita de Escocia,50,"Santa Margarita de Escocia es recordada como una figura ejemplar del siglo XI, nacida en Hungría y casada con Malcolm III, rey de Escocia. Su vida estuvo marcada por un profundo sentido de devoción y servicio. Fue madre de ocho hijos, a quienes educó en la fe cristiana, y dedicó su vida al bienestar del reino y la Iglesia. Conocida por su generosidad hacia los pobres, Margarita combinaba la oració",margarita_de_escocia.jpg,https://es.wikipedia.org/wiki/Margarita_de_Escocia_(santa),
11,16,Beata Lucia de Narni,40,"La Beata Lucia de Narninació en 1476 en Narni, Italia. Conocida por sus profundas experiencias místicas, dedicó su vida a la fe y la espiritualidad. Tras una vida de devoción, falleció en 1544 en Ferrara. Su festividad se celebra el16 de noviembre, recordándola como una figura espiritual del siglo XVI. Lucia fue una mujer de gran carisma y fe, destacándose por su profunda conexión espiritual. A lo ",lucia_de_narni.jpg,https://es.wikipedia.org/wiki/Lucía_de_Narni,
11,16,Beato Eduardo Osbaldeston,40,"El Beato Eduardo Osbaldeston, nacido en Lancaster, Inglaterra, es recordado por su valentía y fe inquebrantable durante una época de persecución religiosa. Estudió en el Colegio de los Ingleses de Reims, y regresó a su tierra natal como sacerdote católico en un tiempo en que el catolicismo era perseguido bajo el reinado de Isabel I. El 16 de noviembre de 1596, fue condenado a muerte y ahorcado en Y",,https://es.wikipedia.org/wiki/16_de_noviembre,
11,16,Beato Simeón de Cava,40,"El Beato Simeón de Cavaes una figura reverenciada en la historia del cristianismo, conocido por su papel como abad en el monasterio de Cava, situado en la región de Campania, Italia. Celebrado el16 de noviembre, el Beato Simeón dejó una huella profunda en la comunidad monástica de su tiempo. Simeón dedicó su vida al servicio religioso, guiando a su comunidad con sabiduría y devoción. Su liderazgo s",simeon_de_cava.jpg,https://es.wikipedia.org/wiki/Alferio_de_la_Cava,
11,16,San Edmundo Rich,50,"San Edmundo Rich fue un destacado obispo de Canterbury del siglo XIII, conocido por su valiente defensa de los derechos de la Iglesia. Nacido en Abingdon, Inglaterra, su vida estuvo marcada por una profunda espiritualidad y un firme compromiso con los principios eclesiásticos. Edmundo Rich estudió en las universidades de Oxford y París, especializándose en teología. Fue nombrado arzobispo de Cante",edmundo_rich.jpg,https://es.wikipedia.org/wiki/George_Edmund_Street,
11,16,San Euquerio de Lyon,50,"San Euquerio de Lyon, nacido en el seno de una familia senatorial, se retiró inicialmente con su familia a una vida de contemplación en una isla cercana a Lérins. Posteriormente, fue elegido obispo de Lyon, donde dejó una huella imborrable en la comunidad cristiana con sus escritos sobre las pasiones de los mártires. San Euquerio es recordado especialmente el 16 de noviembre, fecha de su festivida",euquerio_de_lyon.jpg,https://es.wikipedia.org/wiki/Euquerio_de_Lyon,
11,16,San Fidencio obispo,50,"El16 de noviembrese celebra la festividad deSan Fidencio, un obispo reconocido por su ferviente dedicación a la fe cristiana y su liderazgo espiritual. A lo largo de su vida, Fidencio se destacó por su capacidad para guiar a su comunidad y su compromiso con los valores cristianos. San Fidencio es recordado no solo por sus contribuciones como líder religioso, sino también por su capacidad para insp",fidencio_obispo.jpg,https://es.wikipedia.org/wiki/Diócesis_de_Querétaro,
11,16,San Otmaro de Suiza,50,"San Otmaro, también conocido como Otmar, fue un notable abad del siglo VIII en Suiza, recordado por su dedicación a los enfermos y su defensa de los derechos monásticos. Nacido entre los helvecios, Otmaro estableció un pequeño hospital destinado a leprosos cerca de la celda construida por San Galo. Además, fundó un cenobio siguiendo la Regla de San Benito, lo que marcó un hito en la vida monástica",otmaro_de_suiza.jpg,https://es.wikipedia.org/wiki/Otmaro_de_San_Galo,
11,16,San Roque González y compañeros,50,"San Roque Gonzálezfue un valiente sacerdote jesuita que dedicó su vida a la evangelización de los pueblos indígenas en América del Sur. Nacido en Asunción, Paraguay, fue uno de los primeros mártires del continente. Roque González se unió a la Compañía de Jesús y trabajó arduamente para establecer reducciones jesuíticas en Paraguay, donde promovió la fe cristiana y la paz entre las comunidades indí",roque_gonzalez_y_companeros.jpg,https://es.wikipedia.org/wiki/Roque_González_de_Santa_Cruz,
11,16,Santa Gertrudis Magna,50,"Santa Gertrudis Magna, nacida en Eisleben, Alemania, en el siglo XIV, es recordada por su profunda vida espiritual y mística. Ingresó al monasterio cisterciense de Helfta a temprana edad, donde se dedicó al estudio de las letras y la oración. Su devoción a Cristo crucificado la convirtió en un ejemplo de perfección espiritual. Gertrudis fue una religiosa de la Orden de San Benito, conocida por sus",gertrudis_magna.jpg,https://es.wikipedia.org/wiki/Gertrudis_Magna,
11,16,Santa Inés de Asis,50,"Santa Inés de Asís, nacida en Asís, Italia, en el siglo XIII, es conocida por su devoción y compromiso con la pobreza. Siguiendo el ejemplo de su hermana, Santa Clara, Inés se unió a la Orden de los Frailes Menores, fundada por San Francisco de Asís. En el convento de San Damián, dedicó su vida a la oración y al servicio de los necesitados. Su festividad se celebra el16 de noviembre, recordando su",ines_de_asis.jpg,https://es.wikipedia.org/wiki/Inés_de_Asís,
11,16,Santa Lucía de Narni,50,"Santa Lucía de Narni, nacida en Narni, Italia, es una figura venerada por sus profundas experiencias místicas y su devoción religiosa. Perteneciente a la Orden de Predicadores, Lucía es conocida por recibir estigmas y tener visiones celestiales, lo que la convirtió en un símbolo de fe y devoción en su tiempo. Su vida estuvo marcada por un profundo compromiso religioso, y su legado perdura hasta ho",lucia_de_narni.jpg,https://es.wikipedia.org/wiki/Lucía_de_Narni,
11,17,San Gregorio Taumaturgo,50,"San Gregorio Taumaturgo, nacido en Neocesarea del Ponto, en la actual Turquía, fue un obispo cristiano del siglo III famoso por sus habilidades milagrosas. Originalmente un joven que abrazó la fe cristiana, se destacó por su profundo conocimiento tanto de las ciencias divinas como humanas. Su dedicación y virtudes le valieron el apodo de 'Taumaturgo', que significa 'Hacedor de Milagros'. Gregorio ",gregorio_taumaturgo.jpg,https://es.wikipedia.org/wiki/Iglesia_de_San_Gregorio_Taumaturgo,
11,17,Santa Isabel de Hungría,50,"Santa Isabel de Hungría, nacida el 7 de julio de 1207, es recordada por su extraordinaria dedicación a los pobres y enfermos. Casada con Luis, landgrave de Turingia, Isabel tuvo tres hijos antes de quedar viuda. Tras su viudez, se retiró a Marburgo donde fundó un hospital y vivió en completa pobreza hasta su muerte el 17 de noviembre de 1231. Canonizada en 1235 por el Papa Gregorio IX, Santa Isabe",isabel_de_hungria.jpg,https://es.wikipedia.org/wiki/Isabel_de_Hungría,
11,17,Santa Victoria de Córdoba,50,"Santa Victoria de Córdoba es una figura emblemática del cristianismo temprano, conocida por su martirio en la ciudad de Córdoba, Hispania Bética, durante el siglo IV. Junto a su hermano Acisclo, enfrentó la persecución con valentía, convirtiéndose en un símbolo de fe inquebrantable. Victoria y Acisclo fueron arrestados por su fe cristiana y, tras negarse a renunciar a sus creencias, fueron ejecuta",victoria_de_cordoba.jpg,https://es.wikipedia.org/wiki/Victoria_(mártir_del_siglo_IV),
11,17,Beata Salomé de Cracovia,40,"La Beata Salomé de Cracoviaes recordada por su notable transición de la vida real a la religiosa. Nacida en el siglo XIII, fue reina de Halicz (Galizia) hasta la muerte de su esposo, el rey Colomano. Tras enviudar, Salomé decidió dedicar su vida a la devoción y la humildad, ingresando a la Segunda Orden de San Francisco. Fundó un monasterio de clarisas en Cracovia y se convirtió en su abadesa, lide",salome_de_cracovia.jpg,https://es.wikipedia.org/wiki/Basílica_de_San_Francisco_de_Asís_(Cracovia),
11,17,Beato Josafat Kocylovskyj,40,"El Beato Josafat Kocylovskyj, nacido en Ucrania, fue un destacado obispo de Przemysl conocido por su valentía al enfrentar la opresión religiosa en su país. Durante el régimen enemigo de Dios, entregó su vida como un fiel discípulo de Cristo. Se le recuerda cada17 de noviembre. Josafat nació en Capaivca, Kiev, y se convirtió en obispo de Przemysl. Su liderazgo espiritual fue crucial durante tiempos",josafat_kocylovskyj.png,https://es.wikipedia.org/wiki/Josafat_Kocylovskyj,
11,17,Beato Lope Sebastián Hunot,40,"El Beato Lope Sebastián Hunotes recordado como un mártir de la Revolución Francesa. Nacido en Sens, Francia, fue un sacerdote que sufrió bajo las difíciles condiciones de la prisión en una antigua nave anclada en Rochefort. Lope Sebastián fue arrestado por su fe y condición sacerdotal, y confinado en una nave insalubre durante la persecución religiosa. Allí, soportó la dureza de la cautividad hasta",,https://es.wikipedia.org/wiki/17_de_noviembre,
11,17,San Acisclo de Córdoba,50,"San Acisclo de Córdoba es recordado como un mártir cristiano del siglo IV en la provincia hispánica de la Bética. Su vida y martirio son un testimonio de fe en tiempos de persecución. Se celebra cada año el 17 de noviembre, recordando su valentía y devoción. Nacido en Córdoba, San Acisclo vivió en una época en que el cristianismo enfrentaba duras pruebas. Su martirio simboliza la resistencia y la ",acisclo_de_cordoba.jpg,https://es.wikipedia.org/wiki/Acisclo,
11,17,San Alfeo de Cesarea,50,"San Alfeo de Cesareafue un valiente mártir cristiano del siglo IV. Junto a San Zaqueo, fue condenado a muerte en Cesarea de Palestina durante la primera ola de persecuciones iniciadas por el emperador Diocleciano. Su festividad se celebra el17 de noviembre. San Alfeo se destacó por su inquebrantable fe en Dios y Jesucristo, lo que le llevó a soportar numerosos tormentos antes de ser condenado a mu",alfeo_de_cesarea.jpg,https://es.wikipedia.org/wiki/Alfeo_y_Zaqueo,
11,17,San Aniano de Orleáns,50,"San Aniano de Orleáns, celebrado el 17 de noviembre, fue un obispo valiente del siglo V en la Galia Lugdunense, actual Francia. Es famoso por su ferviente fe y liderazgo durante el asedio de los hunos a Orleáns alrededor del año 453. Aniano es recordado por su intensa devoción y llanto en oración, pidiendo la ayuda divina para salvar su ciudad. Su fe inquebrantable inspiró a muchos y, según la tra",,https://es.wikipedia.org/wiki/821,
11,17,San Florino de Rëmus,50,"San Florino de Rëmüses recordado por su ferviente dedicación al servicio de la comunidad en la región de Recia, en la actual Suiza. Su vida ejemplar como sacerdote dejó una huella imborrable en la historia de la Iglesia. Florino nació en el seno de una comunidad cristiana y dedicó su vida al sacerdocio, centrándose en el cuidado espiritual de su parroquia. Su entrega lo convirtió en una figura de ",,https://es.wikipedia.org/wiki/Iglesia_de_San_Florián,
11,17,San Hugo de Lincoln,50,"San Hugo de Lincoln, nacido en el siglo XIII, es reconocido por su firme liderazgo en la diócesis de Lincoln, Inglaterra. Como monje cartujo, fue llamado a ser obispo, destacándose por su compromiso con la justicia y la defensa de la Iglesia. Su festividad se celebra el 17 de noviembre. Para más información sobre su vida y otros santos, visita Wikipedia. San Hugo fue un monje cartujo antes de ser ",hugo_de_lincoln.jpg,https://es.wikipedia.org/wiki/Hugo_de_Lincoln,
11,17,San Hugo de Noaria,50,"El 17 de noviembre se celebra aSan Hugo de Noaria, un abad cisterciense del siglo XII. Enviado por San Bernardo de Claraval, Hugo fue fundamental para establecer la Orden del Císter en Noaria, Sicilia y Calabria. San Hugo dedicó su vida a expandir la espiritualidad cisterciense, conocida por su enfoque en la austeridad y el trabajo manual. Su legado perdura en las comunidades monásticas que fundó,",hugo_de_noaria.jpg,https://es.wikipedia.org/wiki/Hugo_de_Novara,
11,17,San Juan del Castillo,50,"San Juan del Castillo, nacido en Belmonte, Cuenca, España, fue un sacerdote de la Compañía de Jesús que dedicó su vida a las misiones en Paraguay. Fue martirizado el 17 de noviembre de 1628 por su defensa de la fe y su oposición a las prácticas mágicas locales. Su misión en las reducciones, fundadas por San Roque González, buscaba evangelizar y proteger a las poblaciones indígenas. Juan del Castil",juan_del_castillo.jpg,https://es.wikipedia.org/wiki/Juan_del_Castillo_(santo),
11,17,San Lázaro de Constantinopla,50,"San Lázaro de Constantinopla, nacido en Armenia, es recordado por su valentía en defender el culto a las imágenes sagradas durante el siglo IX. Enfrentó torturas bajo el mandato del emperador iconoclasta Teófilo, quien ordenó la destrucción de sus obras artísticas. Sin embargo, Lázaro permaneció firme en su fe y, tras la pacificación de las controversias iconoclastas, fue enviado por el emperador ",lazaro_de_constantinopla.jpg,https://es.wikipedia.org/wiki/Lázaro_Zographos,
11,17,San Namacio de Vienne,50,"San Namacio de Vienne fue un destacado obispo del siglo VI, conocido por su justo desempeño tanto en los cargos civiles como eclesiásticos. Se le recuerda especialmente en Vienne, una región de la antigua Burgundia, que hoy forma parte de Francia. San Namacio fue un líder respetado que honró y fortaleció la sede episcopal de Vienne. Su legado perdura en la historia de la Iglesia por su dedicación ",,https://es.wikipedia.org/wiki/17_de_noviembre,
11,17,San Raveriano monje,50,"San Raveriano, un monje cuya vida estuvo marcada por una profunda fe y servicio a la comunidad, es celebrado el17 de noviembre. Su dedicación hacia los valores cristianos lo convierte en un ejemplo digno de admiración y respeto. La figura de San Raveriano inspira a muchos fieles a seguir su camino de devoción y humildad. En su festividad, se realizan diversas actividades religiosas en su honor, re",,,
11,17,Santa Hilda de Whitby,50,"Santa Hilda de Whitby, nacida en el siglo VII en Northumbria, actual Reino Unido, es celebrada cada 17 de noviembre. Como abadesa, fue una figura clave en la formación de la comunidad monástica, promoviendo la lectura de las Escrituras y la vida en armonía. Tras abrazar la fe cristiana, Hilda fue puesta al frente del monasterio de Whitby, donde se centró en educar tanto a monjes como a monjas. Su ",hilda_de_whitby.jpg,https://es.wikipedia.org/wiki/Hilda_de_Whitby,
11,17,Santa Ilda de Inglaterra,50,"Santa Ilda, conmemorada el17 de noviembre, fue una figura influyente en la iglesia anglosajona. Reconocida por su devoción y habilidades de liderazgo, Ilda desempeñó un papel crucial en el establecimiento de la tradición monástica en Inglaterra. Nacida en una familia de la nobleza, Ilda optó por una vida de fe y servicio. Dirigió el monasterio de Whitby, convirtiéndolo en un centro de aprendizaje ",ilda_de_inglaterra.jpg,https://es.wikipedia.org/wiki/Hilda_de_Whitby,
11,17,Santos Zaqueo de Cesarea,25,"El 17 de noviembre recordamos a los santos Zaqueo y Alfeo, quienes fueron mártires en Cesarea de Palestina en el siglo IV. Durante la persecución de Diocleciano, ambos confesaron valientemente su fe en Dios y Jesucristo. A pesar de sufrir numerosos tormentos, no renunciaron a sus creencias, lo que los llevó a su condena y ejecución. Zaqueo, cuyo nombre también es compartido por otros santos como S",santos_zaqueo_de_cesarea.jpg,https://es.wikipedia.org/wiki/Alfeo_y_Zaqueo,
